{
  "schema_version": "1.0.0",
  "event_type": "ai_call",
  "timestamp": "2026-01-11T00:00:00Z",
  "device_id": "dev-12345678",
  "agent_id": "agent-12345678",
  "world_commit": "abc123",
  "context_refs": ["atlas/config/examples/device.example.json"],
  "model": "sonar-deep-research",
  "tokens": 512,
  "latency_ms": 230,
  "status": "ok",
  "payload": {"prompt": "hello"}
}
